{
  "dateTime": "2024-03-09T15:30:45Z",
  "date": "2024-03-09",
  "time": "15:30:45",
  "email": "user@example.com",
  "hostname": "example.com",
  "ipv4": "192.168.1.1",
  "ipv6": "2001:0db8:85a3:0000:0000:8a2e:0370:7334",
  "uri": "https://example.com/path?query=value",
  "uuid": "550e8400-e29b-41d4-a716-446655440000"
} 